No.,Persona,Conversation
1,Patient,"I've been feeling really sick lately, and I'm worried I might have COVID-19. What should I do?"
1,Relational Agent,"I'm sorry to hear that you're not feeling well. Based on your symptoms, it's possible that you could have COVID-19. I would recommend that you self-isolate and get tested as soon as possible. Would you like me to help you find a testing center in your area?"
2,Patient,"I tested positive for COVID-19, and I'm really scared. What should I do?"
2,Relational Agent,I understand that this can be a scary and stressful time. The most important thing is to take care of yourself and follow the guidelines from your healthcare provider. Is there anything specific that you're worried about or need help with?
3,Patient,I'm feeling really anxious and depressed because of COVID-19. I don't know how to cope.
3,Relational Agent,"I'm sorry to hear that you're struggling with anxiety and depression. It's normal to feel overwhelmed during times like these. Have you considered talking to a mental health professional? I can help you find resources in your area, or we can talk more about coping strategies that might help."
4,Patient,I'm not sure if the COVID-19 vaccine is safe. I'm afraid to get it.
4,Relational Agent,"I understand that there can be concerns and questions about the vaccine. However, the vaccine has undergone rigorous testing and has been shown to be safe and effective. Would you like me to provide more information about the vaccine, or connect you with a healthcare provider who can answer your questions?"
5,Relational Agent,"Hi there! My name is Ruby, and I'm a mobile application-based relational agent. How can I help you today?"
5,Patient,"Hi Ruby, I'm feeling really anxious and overwhelmed about the COVID-19 pandemic. I don't know how to cope."
5,Relational Agent,I'm sorry to hear that you're struggling with anxiety and stress. It's normal to feel overwhelmed during times like these. Have you tried any coping strategies that have worked for you in the past?
5,Patient,Not really. I don't know what to do.
5,Relational Agent,"That's okay. There are many different strategies that can be helpful, such as deep breathing, meditation, exercise, or talking to a mental health professional. Would you like me to connect you with resources in your area, or do you want to talk more about specific strategies that might work for you?"
5,Patient,"Yes, please. Can you help me find a mental health professional in my area?"
5,Relational Agent,Of course. Let me look up some resources for you. Do you have a preferred location or type of provider?
5,Patient,"I live in New York City, and I would prefer someone who specializes in anxiety and stress."
5,Relational Agent,"Great. I found a few providers in your area who specialize in anxiety and stress. I can send you their contact information, or I can help you schedule an appointment if you prefer. What works best for you?"
5,Patient,Can you help me schedule an appointment? I don't know how to do that.
5,Relational Agent,Sure thing. Let's work together to find a time and date that works for you. How about next Wednesday at 2pm?
5,Patient,"That works for me. Thank you, Ruby"
5,Relational Agent,You're welcome! Please let me know if there's anything else I can do to support you.
6,Relational Agent,Hello! I'm a mobile application-based relational agent. What can I help you with today?
6,Patient,"Hi, I tested positive for COVID-19, and I don't know what to do."
6,Relational Agent,I'm sorry to hear that you've tested positive. It's important that you selfisolate and follow the guidelines from your healthcare provider. Do you have any specific symptoms or concerns that you would like to discuss?
6,Patient,"Yes, I'm feeling really tired and short of breath. I'm worried that it might get worse."
6,Relational Agent,I understand your concerns. It's important that you monitor your symptoms and seek medical attention if they worsen or if you have trouble breathing. Have you spoken with your healthcare provider about your symptoms?
6,Patient,"No, I haven't. I don't know how to contact them."
6,Relational Agent,I can help you with that. Do you have the contact information for your healthcare provider?
6,Patient,"Yes, I have their phone number."
6,Relational Agent,"Great. Let me look up their hours of operation and availability. Would you like me to make the call for you, or do you want to do it yourself?"
6,Patient,Can you make the call for me? I don't feel well enough to do it.
6,Relational Agent,"Of course. Let me place the call and see if I can connect you with your healthcare provider. While we're waiting, is there anything else I can help you with or any questions you have about COVID-19?"
6,Patient,"No, that's all for now. Thank you for your help."
6,Relational Agent,"You're welcome. Please take care of yourself, and don't hesitate to reach out if you need anything else."
7,Relational Agent,Hi there! I'm a mobile application-based relational agent. How can I assist you today?
7,Patient,"Hello, I'm feeling really worried about getting infected with COVID-19. I don't know what to do to protect myself."
7,Relational Agent,I understand how you feel. It's essential to take preventive measures to reduce the risk of contracting the virus. Have you taken any precautions to protect yourself?
7,Patient,"I wear a mask and wash my hands regularly, but I'm still scared."
7,Relational Agent,"That's good to hear that you're taking those precautions. Would you like me to provide more information on how to protect yourself, or do you want to talk about why you feel scared?"
7,Patient,I want more information on how to protect myself.
7,Relational Agent,"Of course. There are several steps you can take to protect yourself from COVID-19, such as social distancing, avoiding large gatherings, and staying home if you feel sick. I can also provide you with links to reputable sources of information on COVID- 19. Would you like me to send you that information?"
7,Patient,"Yes, please. That would be helpful."
7,Relational Agent,Great. Let me pull up that information for you. Here are some helpful links to learn more about COVID-19 and how to protect yourself: [insert links]. Is there anything else I can help you with?
7,Patient,"No, that's all for now. Thank you."
7,Relational Agent,You're welcome. Please don't hesitate to reach out if you need any more assistance.
8,Relational Agent,"Hi there! My name is Sarah, and I'm a mobile application-based relational agent. How can I support you today?"
8,Patient,"Hello, I'm having trouble coping with the stress and anxiety caused by COVID-19. I feel like I'm losing control."
8,Relational Agent,I'm sorry to hear that you're struggling with stress and anxiety. It's common to feel overwhelmed during this pandemic. Have you tried any strategies to manage your stress and anxiety?
8,Patient,"No, I haven't. I don't know where to start."
8,Relational Agent,"That's understandable. There are several effective strategies you can use to manage stress and anxiety, such as mindfulness, exercise, and talking to a mental health professional. Would you like me to help you find resources for coping strategies or connect you with a mental health professional?"
8,Patient,I would like to find some coping strategies.
8,Relational Agent,"Sure. Let me pull up some resources for you. There are several apps and websites that offer free resources for coping with stress and anxiety, such as Calm, Headspace, and the National Alliance on Mental Illness. Would you like me to send you the links to these resources?"
8,Patient,"Yes, please. That would be great."
8,Relational Agent,Great. Here are the links to the resources I mentioned: [insert links]. I hope you find these helpful. Is there anything else I can help you with?
8,Patient,"No, that's all for now. Thank you, Sarah."
8,Relational Agent,You're welcome. Please take care of yourself and let me know if you need anything else.
9,Relational Agent,Hello there! I'm a mobile application-based relational agent. How can I assist you today?
9,Patient,"Hi, I think I might have COVID-19. I'm really scared."
9,Relational Agent,I understand how you feel. It's completely normal to feel scared during a pandemic like this. Can you tell me more about your symptoms?
9,Patient,"I have a fever, cough, and difficulty breathing."
9,Relational Agent,I'm sorry to hear that. It's important to take this seriously and get medical attention. Have you been tested for COVID-19 yet?
9,Patient,"No, I haven't."
9,Relational Agent,"Okay, well, the first step is to contact your doctor or local health department to schedule a COVID-19 test. They will be able to give you more information on where to go and what to expect during the testing process. Additionally, I can provide you with some trustworthy resources on COVID-19 and how to protect yourself and others. Would you like me to send you those resources?"
9,Patient,"Yes, please. That would be helpful."
9,Relational Agent,"Great. Here are some helpful links to learn more about COVID-19 and how to protect yourself: [insert links]. Please keep in mind that it's important to stay home and self-isolate until you receive your test results. If you have any questions or concerns, please don't hesitate to reach out to me."
9,Patient,"Thank you, that's really helpful."
9,Relational Agent,You're welcome. Please take care of yourself and let me know if you need anything else.
10,Relational Agent,Hi there! I'm a mobile application-based relational agent. How can I support you today?
10,Patient,"Hi, I'm feeling really overwhelmed with everything going on with COVID-19. It's hard to keep up with all the information and guidelines."
10,Relational Agent,"I understand how you feel. There is a lot of information out there, and it can be difficult to know what to trust. Have you been using any particular sources for information?"
10,Patient,"Not really. I just search online, but it's hard to know what's reliable."
10,Relational Agent,"I see. It's important to use trustworthy sources of information, such as the World Health Organization or the Centers for Disease Control and Prevention. Additionally, it's important to set realistic expectations for yourself and not feel like you need to know everything all at once. Would you like me to send you some links to these trustworthy sources?"
10,Patient,"Yes, that would be helpful."
10,Relational Agent,Great. Here are some links to trustworthy sources on COVID-19: [insert links]. Please remember that it's okay to take things one day at a time and not feel like you have to have all the answers. Is there anything else I can help you with?
10,Patient,"No, that's all for now. Thank you."
10,Relational Agent,You're welcome. Please don't hesitate to reach out if you need any more assistance. Take care.
11,Relational Agent,"Hello, I'm a mobile application-based relational agent. How can I assist you today?"
11,Patient,"Hi, I'm feeling really anxious about getting COVID-19. What if I get really sick?"
11,Relational Agent,"I understand your fears and it's natural to feel anxious during a pandemic like this. However, it's important to stay informed and take precautions to protect yourself. I can provide you with some trustworthy sources that can help you stay up-to-date with the latest information. Would that be helpful?"
11,Patient,"Yes, please."
11,Relational Agent,"Great. Here are some trustworthy sources on COVID-19: [insert links]. It's also important to set realistic expectations about what I can do for you. While I can provide information and support, I'm not a substitute for medical advice or diagnosis. Is there anything else I can assist you with? "
11,Patient,"No, that's all for now. Thank you."
11,Relational Agent,You're welcome. Please take care and let me know if you need anything else.
12,Relational Agent,"Hello, I'm a mobile application-based relational agent. How can I assist you today?"
12,Patient,"Hi, I'm feeling really confused about COVID-19 guidelines. There is so much conflicting information out there."
12,Relational Agent,I understand how overwhelming it can be to navigate all the information out there. It's important to use trustworthy sources and set realistic expectations for yourself. I can provide you with some trustworthy sources on COVID-19. Would you like me to send them to you?
12,Patient,"Yes, please."
12,Relational Agent,"Great. Here are some trustworthy sources on COVID-19: [insert links]. Additionally, while I can provide information and support, it's important to set realistic expectations about what I can do for you. I'm not a substitute for medical advice or diagnosis. Is there anything else I can help you with?"
12,Patient,"No, that's all for now. Thank you."
12,Relational Agent,You're welcome. Please take care and let me know if you need anything else.
13,Relational Agent,"Hello, I'm a mobile application-based relational agent. How can I assist you today?"
13,Patient,"Hi, I'm feeling really lonely and isolated because of COVID-19. I understand how you feel. It can be hard to stay connected with others during this time. I'm here to provide support and help you feel less isolated. Is there anything specific you would like to talk about or need help with?"
13,Relational Agent,"I don't know, I just feel really alone. Okay, well, one way to combat loneliness is to stay connected with others, even if it's just through virtual means. I can provide you with some resources on virtual support groups and ways to stay connected with loved ones. Would you like me to send you those resources?"
13,Patient,"Yes, please."
13,Relational Agent,"Great. Here are some resources that may help: [insert links]. Additionally, it's important to set realistic expectations about what I can do for you. While I can provide information and support, I'm not a substitute for medical advice or diagnosis. Is there anything else I can assist you with? "
13,Patient,"No, that's all for now. Thank you."
13,Relational Agent,You're welcome. Please take care and let me know if you need anything else.
14,Relational Agent,"Hello, how are you feeling today?"
14,Patient,I'm feeling really worried. I think I might have COVID-19.
14,Relational Agent,"I can understand why you might be worried. It's important to know that there are other illnesses that can cause similar symptoms. I can help you figure out if you need to be tested for COVID-19. Have you been experiencing any of the following symptoms: cough, fever, shortness of breath?"
14,Patient,"Yes, I have a cough and a fever."
14,Relational Agent,"Okay, those are two of the main symptoms of COVID-19. It's important that we get you tested. I can refer you to a testing site and provide you with information on what to expect. Would you like me to do that for you?"
15,Relational Agent,"Hello, how are you feeling today?"
15,Patient,I'm really worried about COVID-19. I'm afraid I might have it.
15,Relational Agent,"I understand how you're feeling. It's natural to feel anxious in these uncertain times. It's important to know that testing is available for people who have symptoms or have been exposed to someone with COVID-19. Have you had any symptoms such as cough, fever, or difficulty breathing?"
15,Patient,"Yes, I've had a fever and a cough."
15,Relational Agent,"Okay, those are common symptoms of COVID-19. I can provide you with information on where to get tested and what to expect during the testing process. It's important to follow the guidelines and isolate until you receive your test results. Would you like me to help you schedule a test?"
